ApprovalID,EmployeeID,ApproverID,ApprovalType,Status,DateRequested,DateResponded,Comments
5fcff27d-ea41-4c8a-91c0-2c4a33539fab,39d2c6b9-7497-4174-bf56-82cea0e31e8d,f1c3b370-aa59-49e9-8498-c6c71214f802,Training,Pending,2025-05-19 07:03:16,2025-05-31 21:01:17,Someone value marriage rise determine prevent thought.
fee7f229-7aa1-4d98-88b8-2b7a3420d146,af18ee6b-7a49-4b19-8505-b78a0259e729,0dbbc9dc-9d1b-45be-b691-30a34652dbb7,Training,Pending,2025-05-23 23:51:23,2025-05-06 18:30:37,Process parent ago easy next save help positive rock something popular.
6e3e65c0-9325-477e-ba29-dcddcd25af56,da1d7d9f-ac83-4a35-804f-0a2ae8f38a60,99f0245f-77c0-4ea3-9e5f-148e0eed402f,AccessRights,Approved,2025-05-07 21:23:29,2025-05-26 20:32:59,Student suffer gun against success laugh.
ccb01045-e42c-4400-89a0-a60274b585ad,481b4e37-1ce9-4475-8e3f-1aab5ef843c5,aa23e973-6457-4e94-9d8b-94dbae865f7e,AssetPurchase,Rejected,2025-05-27 09:20:09,2025-05-20 19:09:14,Work three big less heavy him area weight option international.
c061ef81-fd1a-41f1-9d7c-44cbb920df70,68b2e310-fd43-42d6-832b-a066914f04c5,8f727a52-75aa-4569-a418-a13fd10c685f,Training,Approved,2025-05-11 10:16:35,2025-05-29 03:27:30,Book first produce in behind research computer room.
